Unnamed: 0,Review,place
1029.0,"One of the most sacred places for Hindu religion. This is an ancient temple. You can enjoy a nice and longest beach in Asia, local culture and food. Generally a peaceful place in India. A lot of tourists come here every year.",Simhachalam Temple
1030.0,Good place to visit,Simhachalam Temple
1031.0,"can visit the place by bus or private taxi.
It is a temple on the hill and taxi goes upto the top .
good place for short visit( It takes around 4-5 Hours to come back to vizag)",Simhachalam Temple
1032.0,Good temple,Simhachalam Temple
1033.0,A well maintained ancient temple of the most famous hindu god the narasimha swamy...the temole is well connected to the city of Vizag,Simhachalam Temple
1034.0,THE NARASIMHAVATARA TEMPLE,Simhachalam Temple
1035.0,"Holy place in vizag of Lord lakshmi narasimha temple.The Historic Temple at the Simhachalam, built in the 11th Century,One of the best place of worship in Andhra after TIRUPATI.",Simhachalam Temple
1036.0,Visit to Simhachalam - good for mind body and soul !,Simhachalam Temple
1037.0,"I was very keen to visit the temple but didn't have much time. Hence decided to go early in the morning. I was advised to reach at about 6.30 AM. I managed to reach at 07.00 AM and found a vary large queue (Dharmadarsanam - free entry). Since, I had very less time, I had to buy a VIP ticket of Rs 100 for entry. It saved me about 45 minutes ! I completed my Darshan in 20 minutes and came back. The drive up and down the hill was beautiful with clean and green hills, godd and pleasant breeze.",Simhachalam Temple
1038.0,Excellent,Simhachalam Temple
1039.0,Very famous temple situated in the Andhra Pradesh near to Vizag city.Buses are available to the temple from the city.It takes 2 to 3 hours of journey to the temple from the vizag city.,Simhachalam Temple
1040.0,Jai Lord Vishnu,Simhachalam Temple
1041.0,"Situated on top of the Hills 24 Km away from the city of Visakhapatnam. A very famous temple, holy place of Lord vishnu. You can plan to stay a the temple as good boarding and lodging facilities are available. Temple is very clean and well maintained. View from the temple is beautiful. You need t get into seperate queue to receive Prasad.",Simhachalam Temple
1042.0,Famous temple in vizag,Simhachalam Temple
1043.0,It's peaceful place and famous in vizag .the people from various places in India will arrive . now day temple is well developed and convenient to tourists to stay there for few days . the temple which I mostly like is simhachalam .,Simhachalam Temple
1044.0,Holy Place,Simhachalam Temple
1045.0,Its a holy place of lord Vishnu's avatar Varaha Lakshmi Narsimha Swamy. The idol is very auspicious and the lord fulfill all our wishes. He is the protector of this world. Lodging facilities with food is available.,Simhachalam Temple
1046.0,Jai Narsimha Dev,Simhachalam Temple
1047.0,"Simhachalam is Lord Narsimha Devsthanam which is situated on the top of the hill almost 20 kms away Vizag. It is advisable to visit early in the morning to have darshans of the deity. For prasadam there is a queue system in the premises of temple.
Very nice place for chanting and penance. I sat in the premises of temple for hours without any disturbance. Must Visit.",Simhachalam Temple
1048.0,Simhachalam,Simhachalam Temple
1049.0,"Very strong vibes in the temple. Gives you a feeling of power when you step in there. Only issue is very popular for people who buy new vehicles , will be very crowded on special days.",Simhachalam Temple
1050.0,Nice place,Simhachalam Temple
1051.0,"Excellent Place to visit for this place is not to far from vizag, can get cab and buses to this location",Simhachalam Temple
1052.0,Wonderful Place one should visit,Simhachalam Temple
1053.0,"This was a wonderful experience in Vizag Temple just in the peak & amazing place to have a peace & blessings of Lord Vishnu.
Known as Narsimah Lord with Laxmi devi's.

One can offer poojas with your Gotra & can get blessings. Normally here there will beong ques nut the day I visited was quiet empty & I could get good closer view with Puja performed thru Panditji.

Here if you want to go tbru V I P they will charge you Rs.100/person & direct entry to temple without going in long rounds of ques. Well on percorming pooja with Rs.200 you can also get 2 prasad ladoos afer you come out & can get it collected from prasad counter on producing this receiptz.
Also extra ladoos available on additional payment.

Overall this is a wonderful place if our fellow visitors from all over India & abroad visiting VIZAG I strongly recommend to visit tbis place & take this wonderful experience with you as a memory for ever.",Simhachalam Temple
1054.0,Peaceful experience,Simhachalam Temple
1055.0,Simhachalam temple is atop a group of mountains. Making the journey to temple very very interesting.,Simhachalam Temple
1056.0,SIMHAGIRI,Simhachalam Temple
1057.0,The peacefull temple in vizag ...... Pavithra punyakshetram.... It have two ways to reach the temple by steps and road.... Idol of this god is waffered by sandal every day.... So we can see real idol once in year during may or april...... Excellent sculptures in temple....,Simhachalam Temple
1058.0,Worth Visiting,Simhachalam Temple
1059.0,"Very decent, peaceful place. Must visit. However, visit in a non-festival day so that it is less crowded and to have a good Darshan",Simhachalam Temple
1060.0,The abode of Lord Narasimha,Simhachalam Temple
1061.0,This holy temple is must visit when visiting Visakhapatnam. You are allowed very near to the deity by purchasing a rs. 200 ticket.,Simhachalam Temple
1062.0,Famous temple on a hill,Simhachalam Temple
1063.0,We visit Simhachalam temple regularly. The place is so peaceful and delight. Simhadri appanna darsan will make us so happy. And need to mention that the pulihora Prasaadam is so tasty.,Simhachalam Temple
1064.0,Famous Narasimha swamy temple,Simhachalam Temple
1065.0,"This temple is on small hillock and Narasimha Swamy is main deity. Very big temple located on a large area, it is very ancient temple. Crowded with people from surrounding places as it is very popular",Simhachalam Temple
1066.0,Ystra,Simhachalam Temple
1067.0,"Very nice , good place for to see and very good for darshan when no rush , but entry to main temple inside restricted as they charge 200 Rupees to see God from very near which is not good.",Simhachalam Temple
1068.0,Very Nice Temple to visit,Simhachalam Temple
1069.0,Very good temple to visit during chanadavotsam festival. the journey towards temple is awesum with secerene greeenery,Simhachalam Temple
1070.0,Devotional,Simhachalam Temple
1071.0,It is big devotional place in vizag. Most of movies shooting done here... big temple and big place nice journey good view,Simhachalam Temple
1072.0,Beautiful temple,Simhachalam Temple
1073.0,"Beautiful temple located on top of the hill.
There is a seva/puja which happens at 7-8:30 PM every day. So avoid visiting the temple around that time as devotees are not allowed inside during that time.",Simhachalam Temple
1074.0,majestic temple,Simhachalam Temple
1075.0,simhachalam temple ....no vizag trip is complete without a darshan here. magnificently built on hill top. beautiful and majestic view of god inside.,Simhachalam Temple
1076.0,Same as simhachalam temple.,Simhachalam Temple
1077.0,Same as simhachalam temple.Please refer to the reviews against the simhachalam temple. A good holy place to be in.,Simhachalam Temple
1078.0,A great holy temple,Simhachalam Temple
1079.0,This is another must visit temples while on a trip to Vizag. The temple is located on top of a hill amidst ample nature. While I visited in the evening there wasnt too much of a crowd.,Simhachalam Temple
1080.0,beautiful place...,Simhachalam Temple
1081.0,I was here on the first birthday of my baby. Nice place to see. Well maintained temple with much facilities...,Simhachalam Temple
1082.0,Second After Trupati Temple,Simhachalam Temple
1083.0,"I went to this temple in the end of February this year. First I went to Mallikarjun Swamy temple and from there I took the train to Vishakhapattanam. I took the APRTC bus for sightseeing and it started at 9.00am from city booking center for which I booked the tickets previous evening but we could get only the seats before last row. Guide was directing and helping us to reach to the point so everyone could return ontime also. The tour started from Simhachalam temple. There we had to purchase the tickets for entry. There was a queue so rush was also there. Two-three newly wed couples had come to take the blessings of God. We could manage the darshan of God and took blessings. If one happens to Vishakhapattanam, shouldn't miss it.",Simhachalam Temple
1084.0,Must visit location,Simhachalam Temple
1085.0,"Just a short distance outside Vizag it is a must visit location and not just for the religious significance.
Not only did I like the beautiful drive to the temple but the entire location is very well organized, starting from where to keep the shoe to the Darsan and Prasadam.
Please remember that not only cameras but also mobile phones are also prohibited inside the temple. However, if you did carry one with you, it can always be kept at the token counter for a very nominal fee.",Simhachalam Temple
1086.0,""" Holy visit """,Simhachalam Temple
1087.0,The simhachalam temple is one of the most renowned temples as Lord Narashima swami resides there . you can reach the temple by public transport (bus) to the top of the mountain. Or else we can use the stairs from the bottom of the hill. People if you really want to enjoy your visit reach the temple through the stairs then you will really be glad you saw god.,Simhachalam Temple
1088.0,nice temple,Simhachalam Temple
1089.0,"errible terrible experience of mine and others who ever go there. Although the temple is good, its sculpture is amazing etc... But the management consists of horrible people. People like me come from far away place and then when you enter the temple in a queue, you don't even get to stand",Simhachalam Temple
1090.0,SIMPLY SUPER,Simhachalam Temple
1091.0,"its lord narsimha dev baghavan
should visit this atleast once
a great temple on top of hill
visit it",Simhachalam Temple
1092.0,A temple worth visit,Simhachalam Temple
1093.0,"Located on the top of a hill, this temple surroundings are very serene and you can geta nice view of Vizag from here. we were lucky to visit the temple on a weekday afternoon and there were no rush. The darshan was easy and we enjoyed the prasad given to us after the darshan. We hired a taxi from the city which waited till we were done and perhaps this is the best and convenient way to visit the temple, worth visiting.",Simhachalam Temple
1094.0,Good temple but poor management,Simhachalam Temple
1095.0,"Terrible terrible experience of mine and others who ever go there. Although the temple is good, its sculpture is amazing etc... But the management consists of horrible people. People like me come from far away place and then when you enter the temple in a queue, you don't even get to stand still for 5 seconds to bend your head infront of God. Infact many even complain they could not see the God's idol and their hardwork of standing for hours in the queue all went in vain. We go to temple to pray. And what is the fun if the guards there push every1 to just move fast. They don't even care for woman, children or elder people. They have coupon system for entering and so many different schemes. So its all a business like many other temples are doing. They have made place of worship as their business. Ridiculous!!! Avoid it. Don't waste a day on it.",Simhachalam Temple
1096.0,Temple,Simhachalam Temple
1097.0,"Well known temple in Visakhapatnam....
Located in simhachalam.....morning time is the best time to visit this temple...",Simhachalam Temple
1098.0,Great temple on top of a hill,Simhachalam Temple
1099.0,"A quick drive away from Vizag, this temple is a nice place to visit. A short uphill drive its a popular temple and quite busy everyday. Would suggest to go for the premium VIP entry at 100 rupees a person to cut the queues on weekends especially.",Simhachalam Temple
1100.0,Amazing temple,Simhachalam Temple
1101.0,This is a beautiful temple in the Simhachalam area. It can be located easily and must be included in the trip to Simhachalam,Simhachalam Temple
1102.0,Beautiful temple,Simhachalam Temple
1103.0,This is a beautiful temple located in a serene area. The natural beauty surrounding this temple is simply breathtaking.,Simhachalam Temple
1104.0,Visit Of Simhachalam Temple,Simhachalam Temple
1105.0,"I went to the temple by bus. There are two types of buses. One having H marked number will take you to the top at the temple premises. You can also reach to the top at the temple premises by staircase. I went by bus and came down by stairs. It is dedicated to Lord Narasimha (the man-lion), an incarnation (avatar) of Lord Vishnu. The central shrine was built in Kalinga architectural style.The temple is very beautiful, you can see the whole of Visakhapatnam from the top. You should come down through stairs to enjoy the serene beauty of nature. Overall, You should not miss Simhachalam Temple while you visit Vizag.",Simhachalam Temple
1106.0,Nice place,Simhachalam Temple
1107.0,Nice temple...popular for locals..should go early morning to avoid over crowding.nice view.good clean place,Simhachalam Temple
1108.0,peaceful but crowd,Simhachalam Temple
1109.0,One of the most important places worth visiting in Visakhapatnam. Lord Narasimha Swamy Temple is present here. Better to visit during off-season to avoid heavy crowd.,Simhachalam Temple
1110.0,The Temple of Lord Narasimha,Simhachalam Temple
1111.0,"simhachalam is 15 km away from visakhapatnam main city. a must visit place for the followers of hinduism and it can be visited around the year. once in a year you can see the real statue of lord Narasimha on chandanothsavam day. remaining days the statue is covered with sandalwood paste and looks like an siva linga. it will take 1 to 3 hr to visit the temple depend the type of entry ticket you purchased.One should not forget to visit the victory stambha constructed by the late emperor Sri Krishna Devaraya of vijayanagar dynasty of karnataka, in memory of his victory over this area.",Simhachalam Temple
1112.0,Huge and Well Maintained Temple,Simhachalam Temple
1113.0,"The temple is very close to vizag city. Please try to visit this place in the weekends, also there is huge amounts of rush in the weekdays generally.",Simhachalam Temple
1114.0,great religious place,Simhachalam Temple
1115.0,pieceful place. alos have long where u can stay or arrange marraige functions. only food allow is idli-wada-sambhar,Simhachalam Temple
1116.0,Nice Place . You will love the place for sure,Simhachalam Temple
1117.0,We visited Vishakhapatnam in December 2015. We went to Simhachalam by a private car. It's a must visit if you are in Vizag. You will love the place for sure. One thing I would like to mention that you can't keep your cellphone inside the temple.,Simhachalam Temple
1118.0,Beautiful Temple ..Must Visit Place,Simhachalam Temple
1119.0,"Very beautiful temple at the top of the hill.

How to reach: Bit far from the city (15 KM). You can book cab and reach at the place. Then take local temple bus (Rs 5 per person) and reach at the top within 10 mins.

Once you reach there you can visit the temple and have Prasada of Shiva (Free Lunch) there.

Must visit place in Vizag !!",Simhachalam Temple
1120.0,Worth a visit,Simhachalam Temple
1121.0,"Its a very big temple , worth atleast one visit . its a spacious temple, but no kind of food is available around it.",Simhachalam Temple
1122.0,Lord lakshmi narasimha swami temple,Simhachalam Temple
1123.0,It is very good and old temple located in Simhachalam.It little distance to Visakapatnam.A famous god and good surrounding area with small hills.,Simhachalam Temple
1124.0,Scenic and Divine.,Simhachalam Temple
1125.0,This beautiful temple is located at the top of a hill in divine peace. One has to travel for about an hour from city centre to reach there. Commercial activities in this place some how takes away the beauty of this place. Still worth a try for scenic and divine experience.,Simhachalam Temple
1126.0,Beautiful Temple.,Simhachalam Temple
1127.0,This is a hill top temple with beautiful views around. As in Southern India this temple is open in evenings and mornings. So avoid in afternoon. Being on hilltop gives a great view. So yes its a must visit when you visit Vizag.,Simhachalam Temple
1128.0,Beauftiful temple - must visit when you are in vishapatinam,Simhachalam Temple
1129.0,Do not miss to visit this temple when you are in vishapatinam. Prefer to visit after 5.30 pm to see the real beauty of this location. Good connectivity is available from through government bus operation or private taxi. 15 KM away from city.,Simhachalam Temple
1130.0,Must Visit Temple,Simhachalam Temple
1131.0,This is a must visit temple when anyone who comes from out of vizag. It has got a rich story behind this temple. Nice hill top temple.,Simhachalam Temple
1132.0,Brother of Lord Balaji,Simhachalam Temple
1133.0,I visited the temple in the last month. It is so pleasant place and historical temple. People used to call this temple as Appanna Swamy Temple (Brother of Lord Balaji).,Simhachalam Temple
1134.0,Divine Duty Calling,Simhachalam Temple
1135.0,"Simhadri or Simhachalam is a Hindu temple located in the Visakhapatnam City suburb of Simhachalam in Andhra Pradesh, South India. It is dedicated to Narasimha (the man-lion), an incarnation (avatar) of Vishnu. The temple is situated among hills covered with cashew trees, shrubs, and mango groves and adds the green lusture all around.

My visit to the temple was not as a tourist. Though I have spent 4 years in Visakhapatnam I visited the temple only once as one of friend stayed very close to it. The visit to the temple is no different than any other Hindu temple. Language of money is prevalent here and if you can splash a couple of hundreds you are treated like a VIP. While I am not an atheist but the way management committees handle the temple affairs across the country it literally pisses me off. I mean; to meet your own creator you have to shell out money which is just out of my understanding.

Overall one out of the thousands of temples dedicated to Hindu Gods and Goddesses. Worth a visit.",Simhachalam Temple
1136.0,Great place to worship,Simhachalam Temple
1137.0,This popular temple has introduced crowd controlling measures which makes it difficult to really enjoy the architectural beauty of the place.,Simhachalam Temple
1138.0,Nice place,Simhachalam Temple
1139.0,Good for people of all ages.....::::::.would be in a visit atlas least once list.....landmarks of visakhapatnam,Simhachalam Temple
1140.0,Antarvedisrilakshminarasimhaswamy temple,Simhachalam Temple
1141.0,"Lord Narasimha swamy Temple. Very famous. Situated near the banks of Godavari river. One has to visit to feel the picturesque locations. The divinity cannot be explained. One has to experience it.

To be listed in MUST see .",Simhachalam Temple
1142.0,""" Place of Powerful God""",Simhachalam Temple
1143.0,Very old and well maintained temple. Always you find the temple filled with devotees. This temple is located on hills and approaching road is very nice and thrilling.,Simhachalam Temple
1144.0,Devotion Lord Narsimha avatar of VISHNU,Simhachalam Temple
1145.0,Place of peace and Hill top with Devotional feel with GOD blessings. You can experience the hill top view and one of the Vizag most visiting place.,Simhachalam Temple
1146.0,Spiritual centre,Simhachalam Temple
1147.0,"Simhachalam is located at 20+ km from Visakhapatnam.Frequently Buses available from RTC complex .Bus no 28,6A and 6A/H directly to hill.",Simhachalam Temple
1148.0,As usual crowded place,Simhachalam Temple
1149.0,"Good carvings inside the temple. Crowded place as usual, as like other temples elsewhere. Deity is that of vishnu, but appears like a shiva linga as it is covered most of the time in turmeric",Simhachalam Temple
1150.0,Beautiful temple,Simhachalam Temple
1151.0,"The temple is crowded during most of the time of year, very decently maintained temple in the midst of large mountain and heavily dense forest. Roads are pretty good, recommended if you book your own car.",Simhachalam Temple
1152.0,The Powerful God,Simhachalam Temple
1153.0,"The temple can be marvelled for its architecture and intricate carvings, one of the old and ancient temples of South India.
Lord Narasimha Swamy is one of the powerful avatars of good over evil of Lord Vishnu according to Hindu Mythology.
A visit to this temple is a must for any any religiously or spiritually inclined person visiting this city.
As it is atop a hill the view from the top is also mesmerising.
Apart from extremely auspicious days, rest of the days not a big rush unlike Tirumala.",Simhachalam Temple
1154.0,very cultureral,Simhachalam Temple
1155.0,"We had been till the last end by given ample of ""darshan money"" (extra money for reaching till the idol). If you be there for holiday trip visiting the temple and taking the blessing with little extra money seems worth.",Simhachalam Temple
1156.0,A spiritual sojourn,Simhachalam Temple
1157.0,Simhachalam shrine is one of the oldest temples in Andhra pradesh and is visited by lakhs of tourists every day.it is a wonderful spiritual experience. The temple is a must visit for anyone visiting visakhapatnam,Simhachalam Temple
1158.0,Visiting Simhachalam Temple when ever i visit Vizag,Simhachalam Temple
1159.0,I keep visiting Vizag once in a year.. when ever i visit Vizag city i will make a point to visit Simhachalam Temple.,Simhachalam Temple
1160.0,Simhachalam,Simhachalam Temple
1161.0,"Don't go with auto. They will put you at simhagiri hill base.then u have to approach bus or taxi to go up as the auto can,t climb up to hill.

So direct go via bus or private taxi.lovely devotional place.",Simhachalam Temple
1162.0,A place of peacefulness..!!,Simhachalam Temple
1163.0,"I will go every time this temple with my wife.. Its a good place to view..

just info :

You can find Public transport from RTC complex.",Simhachalam Temple
1164.0,Devotional place,Simhachalam Temple
1165.0,On the first day we visited this temple and mesmerized by the serenity. I felt like the only truth existed there is of the existence of God. You can go through taxi or local buses according to your benefits.,Simhachalam Temple
1166.0,Entry timings restricted,Simhachalam Temple
1167.0,"As usual in South India, entry timings are not very clear. We reached there at about 11.30 AM and found entry barred. We were told to buy Rs100 entry ticket for 12.30 PM entry. However, suddenly we were admitted at 12 Noon. Moreover, once inside, we were asked to pay Rs.200 per person to go close to deity. However, we saw many govt.officials using their clout going with out buying that ticket.Big let down for general tourists like us by mis administration by temple authorities.
Otherwise a picturesque spot and nice place to visit atop a hill .",Simhachalam Temple
1168.0,Pay fees and get priority Darshan,Simhachalam Temple
1169.0,"You need to go far left to deposit shoes and then barefoot. We took 100 rupees per person queue and landed to very end direct while other queue was very big. Once at shrine, take another ticket of Rs 200 per couple and you can go further inside and group puja will be performed.",Simhachalam Temple
1170.0,Temple of Lor Vishnu in Narsingh Avatara on the hills,Simhachalam Temple
1171.0,"Sacred temple of Lord Vishnu in His Narasingha Avatara. It is on the hills. Very serene atmosphere. Grand temple. We had a wonderful darshan of the Lord. The round trip distance is about 45 km from city. We booked an UBER cab for the same and kept the cab waiting during our darshan. We paid about INR 481 for the Uber cab, from hotel Grand Bay to temple and back to hotel, including waiting charges.",Simhachalam Temple
1172.0,blissful experience,Simhachalam Temple
1173.0,"traditional temple from long back
take a VIP ticket to finish darshan early but be prepared to wait in queue for the laddoo if you want some
only 5 given per person",Simhachalam Temple
1174.0,Excellent,Simhachalam Temple
1175.0,For GOD loving people this temple is must & worth visiting. Take a VIP ticket for entry as well as Darshan.,Simhachalam Temple
1176.0,Temple on the top of the mountain,Simhachalam Temple
1177.0,Simhachalam Temple is located at the top of Simhachalam Hill. Make sure to check temple closing timings before you reach there. Usually it is open from 7 AM to 4 PM and 6 PM to 9 PM but it may be closed early if there is special seva on that day.,Simhachalam Temple
1178.0,Old temple,Simhachalam Temple
1179.0,Old and traditional South Indian temple for Nrusinhswami. I dislike wherever they provide separate entry for people who can pay higher and dont go in it. Fortunately here there was no Q and hence I did darshan without paying.,Simhachalam Temple
1180.0,Nrusinha temple,Simhachalam Temple
1181.0,Very old and nice temple. Different lines with different rates (which I hate) are arranged. fortunately we reached just before closing (2.30 to 3.30 pm closing hours) and could do darshan without any queue or paying any charge.,Simhachalam Temple
1182.0,Nice Place,Simhachalam Temple
1183.0,Good Place..If Possible take a VIP ticket otherwise you have to stand in a long Que. Visit between 10 to 12,Simhachalam Temple
1184.0,Unique temple of narasimha swamy,Simhachalam Temple
