Unnamed: 0,Review,place
,Beach was not very clean. certainly not beautiful than rushikonda and yarada beach. But shops near beach sells decorative items at very reasonable price plus lots of scope for bargaining.,RK Beach
,Clean beach amid to city,RK Beach
,The beach is not a very long patch but quite long enough for a walk. The road alongside the beach is broad with wide pavements. Great place for the morning run and the evening walk. Plenty of people at both times of the day. Clean and many eateries along the beach front.,RK Beach
,"Good for morning walk, kids friendly",RK Beach
,Been to RK beach early morning. Neatly maintained roads. Ample parking space and small park for kids.. Beach is good for early morning stroll.,RK Beach
,R K beach Poor cleaning,RK Beach
,"Seen city waste water draining directly to sea....this is seriously blunder from municipal of vizag...how can we enter into this beach? No hygenine....

Rest the roads are well maintained, good for morning walking. But do not enter into the sea...else you will be infected.",RK Beach
,C S RAO,RK Beach
,poor maintenance n no proper facilities for tourists to relax or have clean snacks. no place to park vehicles and unmanageable traffic,RK Beach
,Evening Hangout,RK Beach
,This place is good for morning walks and evening hangouts. There are lot of food options on this road in the evening. In the morning it is joggers paradise. Vehicles are not allowed on this road in the early hours of the day.,RK Beach
,Very good,RK Beach
,RK beach is in the heart of the city. A walk in the evening across the beach gives a very good feeling.,RK Beach
,Most visited place in vizag,RK Beach
,"In vizag Ramakrishna Beach is the best area to spend. Whenever we got time our family will go to RK beach. My baby Enjoysto spend more time at this place even my wife and me.

Evenings are so good here",RK Beach
,R K BEACH,RK Beach
,"a good beach in the city and a must visit place for visiters in visakhapatnam.
the cleanness and maintenance is super.
darshan of kali temple nearby, having variety of street foods and lots of fun",RK Beach
,R k beach Visak,RK Beach
,Best city based beach in Visak. Must visit....photography on the rocks is amazing.... Kali temple nearby.....Kurusura Submarine ata walking distance.... playground for children at adjoining varun beach....great experience,RK Beach
,Beautiful family picnic spot,RK Beach
,"Ramakrishna beach at vizag is a commoners beach. One can see plenty of spots for children to play and enjoy beach food. It is a long beach and extends to the VUDA park which is a nice park.
It is also very close to the submarine museum.
Visitors to Vizag must come to RK beach at least once.
Our visit here a few days back is really memorable thanks to the first shower of the monsoon.",RK Beach
,Novotel Opp Beach Location Free Zone of Public,RK Beach
,"Visakhapatnam People LOve this place and good and cool city in visakhapatnam.
bus convent and food facility available",RK Beach
,"East or west, beaches are the best",RK Beach
,Very good place to relax and chill out with friends. You can't make out how time flies in beaches. Same with this beach. We went with some around 8 friends and had a great time here,RK Beach
,My view,RK Beach
,Heard a lot about this beach RK beach. Dirtiest beach. Can't seat on the sand. Nothing there to enjoy.,RK Beach
,I went for exam and post exam I just went to relax the stress,RK Beach
,"I felt like loosing myself seeing the waves. Flow of water .. dipping legs and fingers, beach cricket by local boys on holidays. Nature was amazing. Water has blue tinge and its much better than any Mumbai beach I have visited. People should reduce throwing objects in to the water otherwise nice to see. People at the place were cool and were not troubling.. unplanned visit would be better but planned visit for Couples may not be great here.",RK Beach
,Always relaxing and exhilerating Bay of Bengal,RK Beach
,"The huge and unpredictable waves of Bay of Bengal, the food vendors, the public enjoying around - nice evening time spent or nice morning walk on the beach - u can never get bored",RK Beach
,Average place,RK Beach
,Visited with family probably with great expectations :) it's a decent place with good cleanliness all around..,RK Beach
,Walk on the beach,RK Beach
,"Now it is very hot here. I went for a walk on Sunday early morning. No traffic at that time. Good 1 hour walk from Gateway Hotel to Park Hotel. It felt earthy to get my feet wet. Great feeling. Just closed my eyes and took a long breath. I also walked in the evening. It is too crowded for me in the evening and too much particles in the air due to heavy traffic. Beach is clean but could improve. Lots of street food but I did not taste any. If you are from US or Europe, you will get sick. It is the water. Just go there and enjoy the sun and the waves.",RK Beach
,My favourite place to unwind,RK Beach
,"I have been to RK beach ever since I was a kid and every time I go there, I am excited. Even now, I feel like a kid when I see the waves crashing, excited and glad to be there. Its my favourite place to unwind. Whenever I was feeling a bit low, I used to go on a stroll there, all by myself. The sound of waves and the breeze always soothed me. When I was back home last month, I visited RK beach, which was after 7 years. I was glad to find that that place still holds the same magic, making me excited and glad to watch the waves crashing on the shore.

Better to go there when it is still late afternoon. It gets crowded once the sun goes down. Also, go a bit farther from the spot you entered the beach (from the bus stop). You will find that not only the place is less crowded giving you some personal space but also the view is beautiful to behold. If you are lucky enough, you can find some sea shells washed ashore there. I found quite a number of them last time I went there :)",RK Beach
,Beach Attraction,RK Beach
,"The Rama Krishna Beach or RK Beach as it is popularly known as, is one of the principal attractions in Visakhapatnam, visited by both tourists and locals.An evening stroll along this beach is a beautiful experience.The best part about this beach is the paved pedestrian walkways that it has, making it smooth and accessible to people of all ages. The beach has it all- well maintained parks, excellent museums, and good open air restaurants. Hawkers selling icecreams, corn on the cob and other tasty snacks have set up their stalls along the beach pavments. A visit to the RK Beach is indeed a pleasant experience, and with the added attraction of enjoying the cool sea breeze and watching the rise and fall of the waves!",RK Beach
,one of the nicest beaches,RK Beach
,this beach was some what special looking(but why i don't know) as usual in every coastal city there was a usual beach road with colourful shops and buildings and heavy traffic.,RK Beach
,ramakrishna beach work and crowdy area,RK Beach
,transitions beach is located centrally to collector office junction working area people go for walk here early morning beach was so busy with street hawkers. abilities chat stalls near park and 5 star hotels located,RK Beach
,Irresistible beach,RK Beach
,"Its one of the oldest tourist spot of vizag. Pleasant place to enjoy the beautiful serene beach. Since its located close to the city, its generally crowded .Many vendors selling eatables, souvenirs are also there.",RK Beach
,"Its a Wide stretch beach on one side on the other side Kali Mata , Shiv Temple, Sri Ganesh Temple .",RK Beach
,"Its a Wide stretch beach on one side on the other side Kali Mata , Shiv Temple, Sri Ganesh Temple...
Sitting in the temple premises gives lot of peace and calms the mind and
sitting wd your family or friends on the neat and clean and the virgin beach has its own charm with vendors selling ice cream, chats, Corn, Phali, Bhelpoori Andhra Style . One will enjoy the evenings.. I can say its a bliss.
“Nicely maintained beach, beautiful sea view”
This is one of the famous beach in Vizag, it is only few km from Dabagardens. it also has nearby coffee shop or restaurants, spread over long way throughout the beach road. Clean, maintained beach. One can spend on this beach.
less
--------
“Ramakrishna Beach (RK Beach)”
RK Beach (Ramakrishna Beach) is one of the cleanest beach located in Visakhapatnam. A very good beach to visit anytime. Pleasant one !!!",RK Beach
,Forget everything...enjoy the beach,RK Beach
,"Perfect for family and friends to get together, enjoying the beautiful seashore. Don't forget to grab famous Tomato bhajji along with Murimixture from local vendors which is like must have when u visit beach. Have fun!",RK Beach
,"Nicely maintained beach, beautiful sea view",RK Beach
,"This is one of the famous beach in Vizag, it is only few km from Dabagardens. it also has nearby coffee shop or restaurants, spread over long way throughout the beach road. Clean, maintained beach. One can spend on this beach.",RK Beach
,Ramakrishna Beach (RK Beach),RK Beach
,RK Beach (Ramakrishna Beach) is one of the cleanest beach located in Visakhapatnam. A very good beach to visit anytime. Pleasant one !!!,RK Beach
,Beaches are always rejuvenating.,RK Beach
,The beach is clean and has many eatery outlets. Nice for a walk.Loved the sculptures along the beach.,RK Beach
,Normal,RK Beach
,There is best place to enjoying in visakhapatnam rk Beach is the first place best pathway local food fish aquarium children park and also best Tea at sukhsagar parlour kalimatha temple,RK Beach
,r k beach,RK Beach
,"its a fantastic beach and we can enjoy with family and friends,i visited this place somany times but still i enjoyed",RK Beach
,Nice to time spent in evening,RK Beach
,"Dear all
It's really nice to enjoy the evening time here..
The lights are looking beautiful.
Nice cool breeze..
Overall nice",RK Beach
,Excellent Place,RK Beach
,I am really surprise to see this beach... what a clean city with respectful people.. really proud to be an indian.,RK Beach
,view point,RK Beach
,it was a beautiful experience to visit rk beach that road side view and good restaurents around it was awesome place,RK Beach
,Cleanliness and Discipline Seems To Be An Issue Here,RK Beach
,"This could be one of the beautiful places but lacks discipline by locals and tourists both. I visited early morning. There were a number of stray dogs in the park. A man in police uniform was peeing just a little away from the beach without bothering about the people who have come to visit the beach. Overall, it seeks a lot of improvement and respect.",RK Beach
,One of the best beaches in vizag.,RK Beach
,"1. Its a great place for fun outing, with family or friends.
2.Free of cost.
3. Lots of options to eat ,right from street snacks to fine dining restaurents.
4. Can spend a minimum of 1hr or more.
5. Very easily accessable
6. No water sports like jet ski, banana ride etc.. which is a downside.
7. Great view from the kailashgiri hills.",RK Beach
,good view,RK Beach
,Well maintained and nicely beautified by the munivcipal corporation. good place to jog and while away.,RK Beach
,adorable beach,RK Beach
,"It is definitely one of the best beaches in India. The panoramic view of the beach from Kailasagiri is awesome. But, one has to be extremely careful while venturing into the waters as this beach is really dangerous due to the presence of rocks in the coast very close to coastal line. The number of cases of drowning of the adventurous kids is very high here. If you are careful, you will enjoy. It is well maintained and the travel y the coastal road up to Bhimili is really enjoyable. you can switch of the a/c in your vehicle and feel the pleasant sea breeze.",RK Beach
,Who says you cannot fall in love with beaches again,RK Beach
,The hot weather and humidity at Vizag making us sweat decided to bit the beach.. and the lovely place is thronged with people.. it's a lovely place with great snack options.. fine dine Resturant opposite to the beaches.. great place to get you feet wet and feel the cool breeze... Also few temple on main road make.it more happening and apart from beaches you can take a stroll to find other interesting places..,RK Beach
,Compulsory place to visit,RK Beach
,In summer places like this makes everyone happy and especially its view from kailasagiri is too good that i cant express in my own words you have to feel on your own.,RK Beach
,Nice beach,RK Beach
,"This popular beach of Vishakapatnam cityof andhra Pradeshis worth spending time, with it being hub of activity and entertainment particularly in the evenings.",RK Beach
,Beautiful view to Bay of Bengal,RK Beach
,"Beautiful View, Water sports available, good place to relax, few restuarant near by, avoid in summers. Best time nov- Jan",RK Beach
,Excellent beach,RK Beach
,One of the best beaches that I have visited. Scenic view is spectacular and heart-warming. Water sports and message spa to be introduced for more and more tourist attraction.,RK Beach
,Jewel of Vizag,RK Beach
,"Considered as the Jewel of Vizag, the main beach on the beach road. Beautiful beach road with local snacks and main attraction of Vizag. Walking path similar to Mumbai's Marrine drive...This is Vizag's Marine drive. This beach road is from RK beach to Rishikonda beach which is around 11 km",RK Beach
,Relax on the seaface esp in the evening,RK Beach
,"I guess this is the sea face where almost entire Vizag comes to relax in the evening. Nice wide footpaths with Street food vendors strewn around at regular intervals. The cool sea breeze blows across your hair and one can relax while walking along the long seaface.
I tried the Muri mixture from a Street food vendor. Something similar to what we call Bhel in Mumbai. Everything is mixed with bare hands which was kind of gross. I dint like the taste even.
I guess this place is best to have a long evening walk. Healthier and cleaner eating options are found across the Beach and the Street food vendors can be avoided.",RK Beach
,Very good beach,RK Beach
,I couldnt stay for long but its very good beach. I took very good pics as the sunset here is amazing. But wait you need to go to Kailasagiri to have the best Sunset View.,RK Beach
,Main tourist spot in Vizag,RK Beach
,You have the view of the sea for some kilo meters in hear of the city... fells very good... if you go for a evening visit..it would give a nice feel...,RK Beach
,Most popular beach in Visakhapatnam,RK Beach
,Clean beach with nice view of bay of Bengal. There is a nice path to walk along or many restaurants to enjoy the breeze from sea. Ideal for evenings,RK Beach
,Software,RK Beach
,Nice place to relax n fun. The novotel location is very good and all the rooms and dining area are searching facing. Staffs are friendly to take care of anything u asked for.,RK Beach
,Most popular beach in Vizag!,RK Beach
,"RK beach as it is also known is the most popular beach in Vizag. Always buzzing with people and tourists. However it is unsafe to swim in the sea! If one has more time in Vizag, would recommend them to visit Rushikonda Beach!",RK Beach
,Mesmerizing Experience,RK Beach
,"It is my favorite place in Vishakhapatnam. It is 5 km away from railway station. The beach provides mesmerizing experience and a breath-taking picturesque location. It is clean , unpolluted. It has changing rooms, bath rooms at affordable rate. It gets well-lit after 6 pm. Hawkers selling bhel puri, pani puri,corn, ice cream surrounds the beach after 6pm which also makes it a great cheap-eats place. The breezy wind around the beech makes you want to sit around the beach for long hours. Many 5 star Hotels are across this beach like Novotel. To put the entire experience in a nutshell, it is a peaceful, beautiful, mesmerizing, eyecany, must see location for every visitor.",RK Beach
,Excellent Location,RK Beach
,"Rk beach it is one of the best beach in South region it is very beautiful place in Visakhapatnam in evening time location of beach and sky is so beautiful it is very near to all hotels and Restaurants. and give the very peacefully to our mind ,",RK Beach
,Beautiful Beach,RK Beach
,"R K beach is the main beach, most crowded beach in vizag, easily available cab here for anywhere. U can enjoy whole time from here.",RK Beach
,Nothing to shout about!,RK Beach
,Beautiful and pristine but getting spoilt! No safety measures have been taken. The place looks deserted in the afternoon-evening hours. Someone should pay attention!,RK Beach
,ONLY TO SEE.,RK Beach
,This beach gave the Vizag city to its beauty in best natural form. The eastern side of the city is opening to the sea mainly through this beach. The beach is very pleasant in the late afternoon/evening. One can only see the beach since it is forbidden to enter in the sea water.,RK Beach
,Quite clean a beach,RK Beach
,"Comparatively clean beach, looks safe and accessible. My only worry was the high tides. Had to be very careful with the children",RK Beach
,Goa of east India,RK Beach
,Nicely developed beach by the GVMC authorities. Great concept of silence zone and happy streets developed.,RK Beach
,Attract of tourism,RK Beach
,The famous of vizag is RK beach.. Beautiful for place for enjoying in evening time with friends and families... Nice maintain... By GVMC..or APTDC...,RK Beach
,Crowded,RK Beach
,"It's probably most accessible beach and people go there without fail. Basically if you are looking for crowd , shops then it's a good place. For peace lover and calm place probably yardha beach is best in Vizag. But RK beach is a good time spend in evening with family. There are some good restaurants and coffee shops to try.",RK Beach
,Excellent Beach,RK Beach
,An excellent beach with good infrastructure and amenities - road modelled on the Marine Drive is fantastic.,RK Beach
,Clean city beach,RK Beach
,"RK beach is one of the cleanest city beaches in the country. Vizag beach is good for walkers and family to relax in the evening. I went for an evening walk in this beach after visiting the submarine museum INS Kursura, which is about a KM away from this lovely beach.",RK Beach
,RK Beach,RK Beach
,This is one of the good beach in Vishakhapattanam (Vizag). Evening time is the best time to visit this place.,RK Beach
,One of best beaches of Vizag,RK Beach
,"We went early in the morning, but missed the sunrise. But it was still great to go early in the morning. Can spend whole day if you are love enjoying in the water. You have horse rides. The beach was very well maintained. our kids loved the place and do not want to come from there.",RK Beach
,Local beach Of Vizag,RK Beach
,This is most popular beach of vizag. But its a little bit crowded. But one can visit to eat street food of local cuisine. Best time to visit is in the evenings.,RK Beach
,RK BEACH IS EXCELLANT,RK Beach
,"excellent beach i never and ever seen first time iam getting full fun.When i went my family on the occasion of Shivarathri. At that time we seen all of star at beach like rana,suman jeevitha and rajashekar",RK Beach
,Rama krishna beach,RK Beach
,"In visakhapatnam one of the most famous beach is rama krishna beach. It gets its name from the Ramakrishna Mission ashrama across the Beach Road from the park. In this beach location is awsome there is a road side the beach and various small children park. We all know visakhapatnam is seaport city so in this city you can easily see big ship. This beach is so clean means that any types of unwanted bags, plastics etc you cannot see here and there in every 100 meters a small dustbin is putted. Various luxurious hotels are here such as novotel, hotel dolphin etc.At evening time this place becomes sooo awsome due to sea breeze. Here you feel very relax. Sooo if you are in vishakapatnam please go at least at rama krishna beach. Thankyou",RK Beach
,Clean and well-maintained. Crowded too.,RK Beach
,"This is the most popular beach in Vizag and that's certainly evident in the number of people visiting this beach all the time. One can find a range of snacks famous in this region sold by lots of hawkers on the foot paths lining the beach road, all along the RK beach. That's the best part. Grab some snacks and enjoy the sea breeze. I liked the beach vibe particularly in the night as it's much more calmer and the climate is much more reasonable in the nights (particularly during hot days, which are like most of the times in the region).",RK Beach
,Main beach in Vizag,RK Beach
,The main beach in the heart of the city. Main tourist attraction of the town is this beach. the beach is always crowed. Having a swim in beach is recommended. The beach have many small rocks. The beach is very near the Naval dockyard and sea fish market. You can see the ships from the beach itself.,RK Beach
,Good place to enjoy the evenings,RK Beach
,"Rama Krishna Beach at Visakhapatnam is a wonderful outing place for all age group. Marine drive almost from Rushikonda to the Harbour is very nice with Buildings/Flats on one side of the road and the Sea on the other side, giving a gallant look.

This beach is to be visited in the evenings to enjoy the spirit of the Joy. The waves of the Sea tempts every one to touch and play with the sea waters. This is a busy area in the evenings and particularly the week ends. Many eateries are available and one can spend hours here enjoying the beauty of the beach.",RK Beach
,Haii,RK Beach
,Haii guys I really enjoy this place with my friends and family I come to this beach every Sunday I enjoy spice fish it's very good in taste you guys can enjoy alot than why..You are waiting till go and enjoy takecare by bye ...zoya,RK Beach
,good but polluted,RK Beach
,the beach is excellent but is little bit polluted where all will throw the waste in the beach so it is polluted.,RK Beach
,Relax n refresh,RK Beach
,"A leisure walk, long stride across this beach in the evening is enough to refresh, sooth n realax you.Watching gigantic waves dancing to the tunes of cool breeze and hand shaking with the hard dark rocks lifts your spirits up. You get to feel why this city is called as ""The city of destiny"" here.

Definitely, it's the most crowded beach in Vizag, also very scenic too. It has a magic in it, it attracts all age groups equally.
Variety of spicy snacks, delicious food sold by local vendors on the beach is a must try.",RK Beach
,this is oplace only for Besch,RK Beach
,this beach is excellenmt for bath and Swim also a plsce of Tour and tourist and touristers then the poeoplr,RK Beach
,Clean and well kept,RK Beach
,A very clean and well maintained beach facing east. All cultural activities in town are conducted around it. The Beach Front is long and ideal for nice morning walk. Be prepared to meet huge crowds in the evening.,RK Beach
,Awwwsome beach,RK Beach
,"must visit places, just sit and relax. you can spent hours by seeing the sky,waves. the environment is very very good",RK Beach
,Beautiful Beach,RK Beach
,"Lovely beach which is suitable for all age groups. Beach is located in the city and in close proximity of most of the popular hotels.

Wide variety of activities are available. Lots of hawkers selling variety of items made of sea shells, wood etc.

Very nice place to spend evening time with friends and family.

Lot of other attractions like Submarine museum, Kali Maa Temple, Ramakrishna Mission etc are in walking distance.

Caution: Beach not suitable for swimming, due uneven terrain and rocks. If want swimming prefer other beaches.",RK Beach
,Popular beach in vizag,RK Beach
,Ramakrishna beach is the one of the popular beaches in vizag.A must visit place for graceful sunsets,RK Beach
,Beautiful place,RK Beach
,"All kinds of people of different age groups are always gets entertained here. horse ridings also available. Must and should visit for beach here, when you are in vizag.",RK Beach
,visit,RK Beach
,great beach you can enjoy a lot with your family and friends nearby submarine museum also is a great attaraction i was there on 31st december night hence there was some musical programme also going on by the side of beach so i enjoyed a lot that night.,RK Beach
,what a relaxing place...,RK Beach
,"well maintained, clean very relaxing place. very beautiful. the beach road is excellent and very organised. should go and feel the peace.",RK Beach
,Nice beach!,RK Beach
,"We got our feet wet here and climbed on some rocks. The waves were a little big that day but the water was warm and clear.
Very pretty place for sunsets despite a little trash in the beach. We usually see horses or cows on the beach.",RK Beach
,dangerous sea looks normal,RK Beach
,"So called R K beach landmark of visakhapatnam, is very good place to chill in the evening. Lot of people from all ages visit here to relax and have fun. This is also very dangerous beach which has heavy current in water. There are signage boards not to swim.",RK Beach
,decorated and decent with low waves,RK Beach
,"nice beach, mostly clean, low waves, we found a man standing as gandhiji, painted all over in silver - looked real for a moment, he reminded me of the line ""life is tough and so are you"".",RK Beach
,the beach to be on.,RK Beach
,"This is a long clean beach stretching almost the entire length of the beach road.
Two sections exist, one at the beginning of the beach road ( behind the parking) where the crowds gather and the one after the submarine museum which is less crowded but has almost no eating places or shacks of any kind (probably because the water in high tide comes almost upto the road.
the slope in the first is more gradual and in the second one steep.Do not however go too deep anywhere as there are no lifeguards or any infrastructure to rescue anyone swept away.
However if you are careful its a lovely beach to enjoy.
Due to the long coastline sunrise and sunset are awesome here.",RK Beach
,Fabulous,RK Beach
