Unnamed: 0,Review,place
I am surprised to see this Studio. It is very beautiful place for the film shooting and for visitors.,Ramanaidu Studio
The view of the sea is awesome from this film city.Good place for outing,Ramanaidu Studio
"Located in hill top. Entry ticket for an adult is Rs 50 and 40 for car. You can find small replica of building like a mahal, police station, hospital, temple etc., which are used in films. You can enjoy clicking photos. …",Ramanaidu Studio
"This is a old film studio where lots of good film has been shooted, there is a museum also where we can see history of film recording, printing systems and some room made for filming seen of hospitals, police station, hotel, etc. Some …",Ramanaidu Studio
Good place to visit,Ramanaidu Studio
Good place to visit with family and kids... Maximum 1hr is enough for the location to spend,Ramanaidu Studio
Good for the actors to visit and get the guidelines from here,Ramanaidu Studio
"May B once upon a time it was good, but now it's very poooor conditions. And it's only preferable for South Indian Old Movie Lovers.",Ramanaidu Studio
"Good. But for people used to RFC Hyderabad, this is no match. View of beach is good from here as it's on hill top near rishikonda",Ramanaidu Studio
Poorly maintained despite 50rs Entry fee...Still you can enjoy hill top view,Ramanaidu Studio
Nice views of hill and sea. Beautiful place for pic lovers,Ramanaidu Studio
One of the best place to visit in Vizag for sure as it has a collection of movies shooted in the film studio and a cinema museum with several fantastic locations,Ramanaidu Studio
This is first studio built in vizag that too in a hill. This place is nice to visit.,Ramanaidu Studio
Excellent place for tourists and also vizag people..,Ramanaidu Studio
Good but very small film city,Ramanaidu Studio
Ramanaidu Film City Built On The Top Of Rishikonda Hills Serves An Enticing  Bird’s Eye View Of The Bay Of Bengal.It Has Produced A Good Number Of Films In Various Indian  Languages. …,Ramanaidu Studio
Not so much attractive as I wish only the view from this studio is superb,Ramanaidu Studio
you have to pay the entry fee. view is good.,Ramanaidu Studio
"Place is good, but rating given for ticket price 50 thay are collecting for the visit.",Ramanaidu Studio
Amazing view and place . Loved it 😊 …,Ramanaidu Studio
I was here on 17.12.2017 at 10.06 am and found this place to be boring. Entry fee is Rs-50 for adults and they charge Rs- 60 for still camera and Rs- 100 for video camera which is too much compared to what they offer inside. Totally …,Ramanaidu Studio
Don't go.. nothing is there to see.  They r charging unnecessarily from people...,Ramanaidu Studio
Good place....Art gallery is very strong....know about history of Indian cinema.....view point is beautiful...Only 1/2 Tiffin place...some shooting place is very poor condition....,Ramanaidu Studio
A medium sized studio.Enjoy the zig-zag road to the studio. Nice place for family outing.,Ramanaidu Studio
I stayed 18 days in Visakhapatnam. Really this is a good place sure I will visit more time  in this place.,Ramanaidu Studio
Nice place to vizit.We can spend some time there. But due to lack of shooting it was not much interested. If shootings starts it will be more attractive.Views from the top are amazing. A visit on a sunny day is recommended.,Ramanaidu Studio
"Please pay attention to what I say before visiting the place.
The place in which the studio is located is nice but there is something mysterious about the place. When I visited the place, I felt something was wrong with …",Ramanaidu Studio
A great film city owned by the family of Rana Daggubati. Great view of the city from the top of the hill.,Ramanaidu Studio
Ok,Ramanaidu Studio
"Ramanaidu studios is awesome film studio in Visakhapatnam, near Rushikonda... we can find the famous police station set... and the big bungalow set and the temple set... the market set and also we can find the museum of cinema room... where …",Ramanaidu Studio
"Except the film musium I find nothing interesting about the place ,  one needs to visit this place to have a glance about Indian movie history and  analog Film Technology",Ramanaidu Studio
One time watch.The place is not at all maintained well,Ramanaidu Studio
Happy with family time. Nice place.,Ramanaidu Studio
"Rama Naidu film studio is located on top of hill, the view from here is breathtaking. And the best part is bean board. On of the best cafe in Visakhapatnam. It contains many sets in here",Ramanaidu Studio
"Ideal for a weekend short get out

Cleanliness to be improved . . .",Ramanaidu Studio
"Excellent  film studio

All south movie are here",Ramanaidu Studio
Nice place to visit,Ramanaidu Studio
Cafe is good and nyc spots for photoshoot,Ramanaidu Studio
One can get an idea of how movie are made . Different sets.,Ramanaidu Studio
Just awesome place... Not studio.. just the scenary,Ramanaidu Studio
Nothing much to see inside. Good for a stroll around the park( too costly if we pay 50rs for that). It woild be more exciting of there was a movie shooting or something else happening. It just felt like a cluster of abandoned buildings,Ramanaidu Studio
Most beautiful place good view best hangout,Ramanaidu Studio
"#U will definitely like the scenery or view from there.
#U will find different places for shooting at one place.
#U can see museum, temple, shops, police station etc for shooting. …",Ramanaidu Studio
"The place with scenic beauty. Good view of sea and hill roads. The film city under it's own infrastructure has detoriated a lot over couple of years. Lot of damages to the properties not attended to. No repairing no painting. Not recommended, at least not the repeat visit.",Ramanaidu Studio
"Definitely one gets the taste of a Film Studio, yet one   can find a great view of the beach and the whole city altogether. The bustling breeze may make you feel cold, even when the rest of Vizag is considerably warm. Also the wind is so strong that you may loose  control of you mobile phones while clicking pictures. So, be careful.",Ramanaidu Studio
Its a great view point but it is very badly maintained and the entry cost 50/- is totally not worth of it. Day by day this place is becoming couples / lovers spot. A great place for photography. Taking a Camera is beneficial.,Ramanaidu Studio
"There is nothing much to see. Old set-up but not maintained well. Entry ticket of Rs. 50 per head is not worth at all. However, good location for photography as it is on the hill top and has agreat view point. So cool and clean place and so …",Ramanaidu Studio
You can have an awesome view of the city from this studio.,Ramanaidu Studio
Superb 🤩 …,Ramanaidu Studio
Awsome place.,Ramanaidu Studio
"Good view and location..
See others photos uploaded here..
But not many sceneries and locations inside.. Small place studio.. …",Ramanaidu Studio
This place has good view points but has only few places inside to take good pictures. Price for each person entry is 60rs as of 6th Nov 2021.,Ramanaidu Studio
Nice Good experience,Ramanaidu Studio
"Viewing of sea from top of the hill is really amazing.
The way from main road to studio is maintaining well.
A lot of scope for further development.
Needs some more improvements.",Ramanaidu Studio
U can spend a day... Scenic view is fantastic.. there is a coffee shop..bean board that is awesome...,Ramanaidu Studio
Worst place during our visit...you have to go long...pay for ticket and get nothing interesting to see...i don't understand why it is in tourist attraction list...better to watch a movie in ticket cost,Ramanaidu Studio
"It's amazing view from hilltop on a breezy day, nothing much to see in the studio.only set of a small temple, hospital,shops,one bungalow set are there,that too not so great looking.old movie equipments of Suresh productions are present in …",Ramanaidu Studio
Nice place for shooting. It has nice structures which help in creating a good picture. It also has a big shooting studio which can be taken on lease. Anybody can take photos with a bull in the park or in a jail which feels too good.,Ramanaidu Studio
"Situated on top of a hillock on the way to Bhemili road, Rama Naidu Studio is a must visit spot of Vizag.   This place offers beautiful location for movies shooting which offers various beautiful structures and buildings, indoor area, beautiful landscaped gardens and many more.",Ramanaidu Studio
Boring place with no maintenance at all. All houses shops are in worst conditions. The only thing good here is the view from top. It's very far from city so better avoid going there and spend relaxing time on near by rushikonda beach.,Ramanaidu Studio
The most scenic place.The studio itself may not have wow factors about it.But the ocean view is amazing. No transport to reach the hill top.Better travel in own vehicle.,Ramanaidu Studio
"Film set was very descriptive, starting from police station, to Bangalow, to Toilet, to garden, and upto small rooms.",Ramanaidu Studio
"here you can see various film making instruments, posters, images and some places for film shooting.but it need to be more informative and more things to be kept for seeking interest. although the place is clean but it should be more carefully maintained.",Ramanaidu Studio
Studio was asom but ticket counter person is too deley for ticket distbueting,Ramanaidu Studio
"Museum is there where you can find old cameras, light etc. From the museum there is  scenic beauty of sea we can much. Don't expect much",Ramanaidu Studio
If you want to go to the Bean Board you don't have to purchase a n entry ticket for Rama Naidu studios. But while returning you have to show the bill for what you have purchased in the Bean Board,Ramanaidu Studio
Only few sets like jail & two three big buildings & one normal traditional house. It should be developed and maintained. Best beach view from the hill.situated in  Outskirts  of vizag. Beach road.,Ramanaidu Studio
I don't why the reviewers are giving 5 star ratings for this place. Yes the place has nice view of beach and scenic drive but the thing is that it lacks proper maintenance. Everything here is Damaged. No proper Landscaping.  No proper …,Ramanaidu Studio
"This place is located on the side road between Vizag. It is a hill top and it is awesome to watch from the studio. From this place you can get very good views of Vizag City, Sea. It has studio rooms, flim making equipment, awards and …",Ramanaidu Studio
"Super
But poor area",Ramanaidu Studio
"Location is very good and Scenic sea from hill view.
Best time to visit is evening hours..
Nice cool sea breeze..",Ramanaidu Studio
"Film studio is a good place to visit with friends and family to explore the duplicate  constructions of villas and aesthetic traditional rural village houses and artifical setups of colony comprised of shops and temples.
Preferred for one time visits except celebrity visit for shootings.",Ramanaidu Studio
The location is really cool and the place needs to be managed well.. The entry ticket is only 50rupees for 5+age... The place was well designed but not maintained in the same way.. I wish it will be one of the best visiting places in vizag for wonderful view points from hill side..,Ramanaidu Studio
"Only visited the cafe, not the studio...worth visiting...nice location and ambience",Ramanaidu Studio
"As it is on the hill it has great view point,The studio itself may not have wow factors about it , but for people used to RFC Hyderabad , the place needs to be managed well..",Ramanaidu Studio
Nice place,Ramanaidu Studio
"Location is great, view is great, best Place to spend the time with loved ones.everything is good.I recommend to visit atleast once😊 …",Ramanaidu Studio
"A good view from the hill top and a small park near the entrance are good... Place is not maintained well.. Sets of temple, bungalow and museum are there. There are many places worth spending your time than this",Ramanaidu Studio
A very good place to hang out with friends. Located on top of the hill its a beauty to see. When you go remember to go on bikes to enjoy the air and its beauty. Remember to carry eatables with you.,Ramanaidu Studio
Worst maintenance.. waste of money....,Ramanaidu Studio
"Only one film studio in visakhapatnam, thanks remanaidu and his sons, t visitors are most enjoying spot. especially in beach view and the hill journey also good.",Ramanaidu Studio
"Actually my First experience at film studios and it was crazier. Rich n poor's houses, police station, hill tpp views, jail and lots of more things are there.
Sea site views from here was Superbbb. …",Ramanaidu Studio
Superb for studio collections of Camares,Ramanaidu Studio
"Not that good like Ramoji Film City, but it gives a nice view of the sea... Place is good for general photography.... However, camera photography is not allowed inside the studio..... Mobile photography is allowed.",Ramanaidu Studio
Fantastic place. But it will be boring during non-shooting days.,Ramanaidu Studio
Good place to hangout for a while in the evening.,Ramanaidu Studio
"As a Film Studio, compared to Ramoji Film city,  Mumbai film city and , even Noida film city which i visited,  this studio may at the best be, rated 3. But if i look it as a place to hang out, it is rated 5. A great scenic beauty,  Words …",Ramanaidu Studio
Not maintained at all and they should close down or hand over to VUDA. May be it has good real estate value for the owners. It is unethical to collect entrance fee from public for seeing the dilapidated buildings and encash the brand name this way. Hope the management take action in the interest of public.,Ramanaidu Studio
Ok but not too good…,Ramanaidu Studio
Awesome view of Sea from here,Ramanaidu Studio
Ramanaidu sir guessed that vizag will develop good and make film city in vizag that too in prime area,Ramanaidu Studio
"The location is price less. But lot needs to be done by management in line of Ramoji studious , Hyderabad to make it a great tourist attraction. It was deserted and appeared management content in increasing property price rather than contribute to the tourism economy of VIZAG",Ramanaidu Studio
"It is only studio in Visakhapatnam & also in Andhra Pradesh dont compare it to Ramoji film city Hyderabad it is one of the biggest studios in Asia,views are best &curves while we drove is really awesome the Beauty of the sea is simply awesome from studio it is a must visit place for everyone.",Ramanaidu Studio
Nice place to visit and take photos and videos. Not So Big as Ramoji Flim City but it is also not less. Many south movies has been shoot here. Near to Rushikonda Beach.,Ramanaidu Studio
Earlier it was quite maintained and beautiful but after the cylone hudhud it lost is attraction....natural views are still very beautiful.,Ramanaidu Studio
"Ramanaidu, a film producer is the owner of the studio. A small studio with few sets are there. For the tourists of Visakhapatnam it is one of the places of attraction. From the top elevation, bay of Bengal is seen along with some hillocks. Nothing special it is, only just addition in the list of spots to Vizag tourists.",Ramanaidu Studio
"A fun place to visit. Especially the view, it's awesome. Go in the evenings and try to go on weekends. It'll mostly be deserted in week days.",Ramanaidu Studio
It is a nice place for Sideview.,Ramanaidu Studio
good place to visit  in vizag with family & friends,Ramanaidu Studio
It's okay but the hill view is the best place in beach road,Ramanaidu Studio
Only few black & white photos of Ramanaidu garu and outdated machinery shifed from Hyd kept as museum. Nothing else is there and waste of money. Building are there in the stage of collapse.,Ramanaidu Studio
No shooting was done here for the last couple of years but still a nice place to visit different sets pretty much ready without renovation,Ramanaidu Studio
"The only film studio in Visakhapatnam. A couple of houses, shops and a temple. Those are the sets for movie shooting. Apart from that, you have two museums - one showing the history of Indian Cinema and the other showing the life history of Dr. Rama Naidu.",Ramanaidu Studio
Disgusting experience..If you like empty buildings this is the place for you. There is only beautiful scenery left. Other than that there is nothing significant worth visiting.,Ramanaidu Studio
On of the best places in Vizag to spend a relaxing evening with good food and a beautiful view. The atmosphere is very relaxing and chill as well!,Ramanaidu Studio
Nice place to visit in winter❄⛄ session.,Ramanaidu Studio
This place has nothing left except the scenery.After hud hud there is a lot of damage done to the studios which has not yet been recovered.The lost and damaged properties sets and built properties are lefr out there to rot.The maintance is …,Ramanaidu Studio
Beatiful place. Located on Hill.  Small studio,Ramanaidu Studio
Nice place to visit but need some development,Ramanaidu Studio
"A Film City Built On The Top Of Rishikonda Hills Serves An Enticing  Bird’s Eye View Of The Bay Of Bengal. Area Wise It Is Definitely Much Smaller Than Ramoji Film City Of Hyderabad, But It Has Produced A Good Number Of Films In Various …",Ramanaidu Studio
Good place to visit. We can get some knowledge how movies are created.,Ramanaidu Studio
"Ok, not worth RS.50",Ramanaidu Studio
This place is ok but not awesome it have some sets which are damaged and not maintained properly it's not too good area with a family with no proper food service the only thing that brings 3 star is awards and photos of artists in this studio is well maintained which gives a clear idea on studio,Ramanaidu Studio
What has made it more interesting is the Coffee Shop called Bean Board. A must visit for coffee lovers. They have a branch in Siripuram Junction also,Ramanaidu Studio
Its Serene..n if its rainy then it feels heavenly,Ramanaidu Studio
Bean Board offers great view and they have games that you can play. They promote the concept of conversations and hence have no TV screens which is a good concept.,Ramanaidu Studio
"Need to maintain properly, if maintained properly with some additional attractive spot it would be an enjoyable play",Ramanaidu Studio
Just a film studio... With different houses. Basically sets... With movie posters being shoot there... Film studies students will get info about the equipments used earlier in making movies..... Nice view of the sea,Ramanaidu Studio
A flim studio on hills. Not worth visiting,Ramanaidu Studio
Place  to see the picturization cameras ….,Ramanaidu Studio
Gr8 view. The journey to this place is exciting. U can get a bird's eye view of the surroundings. The view is awsum from top,Ramanaidu Studio
Good views,Ramanaidu Studio
"Don’t waste your time, money and effort in going to this useless place. There is nothing to see and click.",Ramanaidu Studio
"It's good to visit once ,but most of the places r not maintained",Ramanaidu Studio
Hi ramanaidu Studio Vizag in best place Hill place and nice beach beach view excellent locations and look best places more hour then nice views surrounding lot of flowers narrow roads nearest Bheemili Beach surrounding lot of lot of it centres,Ramanaidu Studio
Small but decorated.,Ramanaidu Studio
Worst & very dirty place... nothing to see... waste of money,Ramanaidu Studio
"Interesting place to visit if you have not visited Ramuji film city, Hyderabad.",Ramanaidu Studio
Best place for site seeing n for shortfilms n photoshoot,Ramanaidu Studio
"Buatyfull today shooting shreya sree and   colour swathi herohion ,hero naveen chandra.",Ramanaidu Studio
"It is good for the tourism , but I found mostly no activities now , ( October 2018 ) . Small area but location is great .",Ramanaidu Studio
"You can have the best sight view of the sea from the top, you have to pay extra charge for camera",Ramanaidu Studio
Its situated at a wonderful place on top of a hill beside the sea.previouly it was used a lot in different movies. But its mainly a tourist spot.,Ramanaidu Studio
Nice & clean sea beach.,Ramanaidu Studio
Good place for one time visit. Can be maintained well,Ramanaidu Studio
good to visit. good memories of old muvies  recollection. view point is excellent. maintainence is required to satisfy the visiters hopes.,Ramanaidu Studio
Nice film studio.. With good theme..,Ramanaidu Studio
Wrost place. No maintenance. Entry 50 RS. 5 RS also waste for that. Only Sea view is better From there,Ramanaidu Studio
Awesome view.,Ramanaidu Studio
Just like a colony  but it's so cool and clean place and the view point so beautiful to see the scenery and all about it's great,Ramanaidu Studio
"I visited on 24.12.13. Very spacious situated in a hill overlooking Bay of Bengal,but  it seems no shooting take place frequently",Ramanaidu Studio
"Good to see such studio,, bit nothing much to explore there",Ramanaidu Studio
Not bad but need to match range of vizag,Ramanaidu Studio
Small film studio in vizag,Ramanaidu Studio
Small flim studio....good place for visit...good photogenic place,Ramanaidu Studio
"Real beauty
Such an elegant place you will feel cheerful to see this.
Specially the hill road view from the studio.",Ramanaidu Studio
It's not a cool place to visit and have some fun ... maintenance is very poor ..old buildings ...lack of proper food facilities,Ramanaidu Studio
One of the beautiful places in vizag to have a great sea view.,Ramanaidu Studio
Not many things to see. As it is in hill top the downward nature is beautyful. Nice place to roam,Ramanaidu Studio
"Except ""Museum of Cinema""....No special places to look for...
Most of the property is in dilapidated condition and its a big disappointment if you compare with RFC.",Ramanaidu Studio
It is a film studio.One should visit minimum once so that gain some knowledge on film making process.It is on hilltop and environment is also very good.,Ramanaidu Studio
Nothing to see there.. recently bean board cafe has been opened.. it has great view.. best to visit during evening,Ramanaidu Studio
The place is like a park with nice views but it doesn't have exciting filmy stuff,Ramanaidu Studio
Very enlightening cinematography museum. Nice environs; the place deserves more hustle bustle.,Ramanaidu Studio
i will not say its a boring place ..again not better than other 'film cities'..view from the top is mesmerizing.,Ramanaidu Studio
Needs loads of maintenance. But worth a visit.,Ramanaidu Studio
Very good mini/small Cinema Studio,Ramanaidu Studio
"Its a nice place and the best part its location.... Simply awesome views of bay of bengal from the studio, for tourists its a must visit place in vizag",Ramanaidu Studio
A film city built on the top of Rishikonda hills serves an enticing bird’s eye view of the Bay of Bengal Visakapatnam in the Indian state of Andhra Pradesh. It has produced a good number of films in various Indian languages. Dr. D. …,Ramanaidu Studio
"For photo shoot and making short films, it's a wonderful place and spend time with family here would remember",Ramanaidu Studio
Its not as that of ramoji film city...But a very good place to see the beauty of vizag beach n roads...,Ramanaidu Studio
Its good to hang out with friends in bean board and the view is amazing and,Ramanaidu Studio
"It has a Museum related to movie industry..
Buildings setup...
Nice Roads...
Excellent view points...",Ramanaidu Studio
Compared to film city......in Hyderabad nothing so great but have a nice view of rishikonda beach,Ramanaidu Studio
Bean board is a nice place to spend time with your friends and family. Overlooking the bay of Bengal.,Ramanaidu Studio
Beautiful location...,Ramanaidu Studio
Feel the passion of cinema over the exhibits of equipment from older generation to new generation nd photos nd the place to get together  with spacious nd modern food courts etc,Ramanaidu Studio
"One of my favorite place. I love the place, it has good scenic beauty and has nice restaurant",Ramanaidu Studio
"Nice place to visit once. However, maintennace can be improved, the place is little abandoned.",Ramanaidu Studio
Nice for one time.. Maintenance is average..,Ramanaidu Studio
Very beatiful place nyc beach view😃 every one thanks to watch nd read my review😄😄😄 …,Ramanaidu Studio
Nice studio.yiu can see many movies sets in here and the best is the view of the sea shore.,Ramanaidu Studio
Not at all very good place to visit. Small studio but views are awesome from the upper points.,Ramanaidu Studio
"Not a big studio, no need of a special visit.",Ramanaidu Studio
It was ok ok......I can say that real beauty is not inside the boundary but its outside......,Ramanaidu Studio
Its just awesome. The view of the seafrom it is amaizing. Good place for taking photos,Ramanaidu Studio
"Nothing so great about the place,just some sets on top a private hill,charges for taking camera inside is not worth of what they charge",Ramanaidu Studio
Great place to visit. Superb view point. Great place for taking photographs & shooting.,Ramanaidu Studio
No maintenance with high cost,Ramanaidu Studio
"Great place with nice winds and views

We can see the sea and mountains",Ramanaidu Studio
"Very old and famous film studio.
It can be used for movie and short films shooting.",Ramanaidu Studio
Nice place to see beach view and to spend time......... But not that much long time like a picinic.......,Ramanaidu Studio
"Nice scenic beauty, but present days studio may be closed permanently.",Ramanaidu Studio
Best place for meeting. But it is costly place. Nice view and it's a photography place.,Ramanaidu Studio
No maintenance. Very sad place. Great views of the saw but the place is not worth visiting,Ramanaidu Studio
It seems the studio is dying,Ramanaidu Studio
Beautiful place .u can spend all day here.nice view point.,Ramanaidu Studio
Beautiful valley and unmatchable beauty of blue Bay of Bengal.,Ramanaidu Studio
Nice place. Know about history of Indian cinema.View of the sea shore is awesome.,Ramanaidu Studio
