Unnamed: 0,Review,place
0.0,Commercial Temple,Simhachalam Temple
1.0,"Excellently maintained temple with exquisite attention to cleanliness. However, it would be wrong to not warn that the property is commercially planned.. You have three slabs for entry and the queue circles accordingly to reach the main temple. All facilities are paid and have queue based on the amount you're willing to provide.",Simhachalam Temple
2.0,Beautiful temple,Simhachalam Temple
3.0,"I visited there in the afternoon , the temple was so big and near to antravedi beach.
Place is very clean and beautiful, in day time there is too hot so if u planning to go in March or upcoming months try to visit this place at evening",Simhachalam Temple
4.0,Sri Varaha Lakshmi Narasimha swamy temple is a powerful deity.,Simhachalam Temple
5.0,Sri Varaha Lakshmi Narasimha swamy temple is located on hallock. There are number of buses available from railway and bus station.The temple is very old . The lord sri Varaha lakshmi Narasimha temple is very power full where visitors from different locations will visit.Chandanotsavam in summer will be the highlight. There are number of cotteges are available.Temple is having lot of carvings with different sculptures.,Simhachalam Temple
6.0,"Sameeksha By Sachin - Temple with Great Mythological, Religious, Historical and Architectural Importance",Simhachalam Temple
7.0,"Sri Varah Lakshmi Narsimha Temple popularly known as Simhachalam Temple is Located at an altitude of about one thousand feet in Visakhapatnam, the largest city of Andhra Pradesh, the main deity of this temple is Lord Sri Varaha Lakshmi Narasimha. This temple is believed to be of 11th Century. It has three outer porches and five gates. The architecture of the temple is of Odia, Chalukya and Chola architectural style. The temple has a chariot structure. The temple also has a Kalyana Mandapa meaning marriage pavilion of 96 pillars. The sanctum sanctorum of the temple is square, with a pyramid shaped roof over the sanctum sanctorum. In front of the sanctum sanctorum is a verandah with a pyramid shaped roof above it. In front of the verandah is the Mukhamandapam of sixteen pillars. There is a Kappasthambam in the temple, it is believed that if a devotee asks for a wish by filling this pillar in his arms with a pure heart, then his wish is fulfilled. Near the temple complex is the source of the natural spring water, which is called Gangadhar. It is believed that whoever takes a bath in this water with faith, all his sins are washed away and all his wishes are fulfilled. There is a pond named Varaha Pushkarani in the temple premises itself.

Overall, this temple of Lord Varaha Narasimha holds an important place in terms of mythological, religious, historical and architectural importance. This temple has a great contribution in Vaishnav tradition. If you go to Visakhapatnam then you should definitely visit the temple.",Simhachalam Temple
8.0,Varah laxmi Temple,Simhachalam Temple
9.0,"Very nice place similar toTirupati.The temple complex is at hill top.The regular bus to th complex is available from the base.
The temple is an unique example of ancient architects and the templesof southIndia.
The entry ticket is to be taken before entering the temple.Thereis a clock room for mobile and shoes & other valuables,which are not allowed inside the temple.The photography is also prohibited. For different darshans and offerings one can take the ticket from the Reception counter at the entry.",Simhachalam Temple
10.0,Commercial,Simhachalam Temple
11.0,You can buy tickets to go direct and pradam is available when you pay money. There are charges for every activity. Pay and get preferential treatment,Simhachalam Temple
12.0,Temple boasts of an excellent hilltop location with lush greenery all around the place...,Simhachalam Temple
13.0,"Simhachalam is Located @15 kms away from Airport and @20 kms away from Bus Station and Railway Station
Simhachalam originally known as Varaha Laxmi Narasimha Swamy Temple is a famous shrine that offers holy and mystical vibes to the devoties. The Simhachalam Temple boasts of an excellent hilltop location with lush greenery all around the place. One of the popular tourist places to visit in Visakhapatnam, Here you can also enjoy a spectacular view from a height of 800 meters above the sea level along with offering your prayers to Lord Narsimha.Simhachalam is one of the 32 Narasimha temples in Andhra Pradesh which are important pilgrimage centres. Simhachalam is the second-largest after Tirumala in Andhra Pradesh in terms of income earned.

Another highlight of this temple is its annual celebration of the Akshaya Tritiya festival that happens to be in the month of April or May every year. On the occasion of this festival, the covering of sandalwood is removed from the idol of Lord Narsimha and the deity comes in its original form for 12 hours i.e., from 4 AM in the morning to 4 PM in the evening and a grand pooja is also organized. Once the Abhishek of the idol is completed, the devotees are allowed to catch a glimpse of the Lord.
Facilities Available:
1. Devastan Domitary Rooms
2. Gajapathi Satram with 48 Rooms
3. TTD Choultry
4. Nityaannadanam is available here which is started in the year 1989 and daily @ 5000 devotees served annaprasadam hear

Temple Timings: Everyday 07:00 am to 04:00 pm & 06:00 pm to 09:00 pm

Travel Tips for Simhachalam Temple:
1. Do not carry your mobile phones and cameras along with you. It is strictly prohibited to capture the pictures inside the temple.
2. Make sure to leave your footwear outside the premise.
Near By Attractions:
1. Indira Gandhi Zoological Park
2. Kambalakonda Wildlife Sanctuary
3. Kailasagiri
4. VUDA Park
5. Rama Krishna Beach

Temple Contact Details: 0891 2764949/0891 2979666",Simhachalam Temple
14.0,Om Namo Lakshmi Narasimha Namaha,Simhachalam Temple
15.0,Beautiful temple with lots of history. Powerful god with serene lush green hills surrounded by and well maintained cleaniness always. Famous about this temple is Lord Nijarupam Darshan which can be seen only 1 day in the entire year. Shouldn't miss it. Should have Pulihora prasad which tastes delicious which u can't get anywhere. Always love to visit Lord Narasimha 🙏,Simhachalam Temple
16.0,VIsit to Simhachalam,Simhachalam Temple
17.0,"This is a divine place dedicated to Lord Narsimha, rudra form of Shri Vishnu. Lot of devotees pay visit everyday. the diety is coated with chandan to keep him cool. the daily prasadam and anna prasadam at 11 is served to all the devotees. Must visit place.",Simhachalam Temple
18.0,Visit to temple,Simhachalam Temple
19.0,"Huge place and like a typical south Indian temple.. still prefer temple Kerala. You don't have to pay to be near ""God""",Simhachalam Temple
20.0,great place to visit,Simhachalam Temple
21.0,Excellent location and great facilities. There should be be more Mobile deposit and the shoe deposit counters near the temple entrance and the carpark.,Simhachalam Temple
22.0,Sri Varaha Narasimha Swamy Temple,Simhachalam Temple
23.0,"It is quite a popular temple in the region. The deity is also known as Appanna locally.

Visited this temple way back in the late 1970s and remember climbing quite a few steps to reach the temple. But now vehicles are allowed right up to the temple.

The deity is supposed to be in the form of a wild boar head, human torso & lion tail but we could not see these features as the idol was covered with Sandal paste giving an appearance of Siva Linga. Understand once in a year one can see the deity on Akshaya Tritiya day with out any sandal paste.

We were lucky to see the temple from Sanctum Sanctorium. One can purchase the ticket for Rs 200. Photography is not permitted inside.

We are lucky to have visited this holy temple.",Simhachalam Temple
24.0,Ugra Narasimha Temple up on the hill! Very nice temple!,Simhachalam Temple
25.0,Very different idol of Varaha Narasimha! It is covered in Sandal wood paste and appears like the Shiva Linga. Tickets are available for quick darshan. Temple is maintained well. However the sculptures carved on almost every pillar of the temple have been damaged. Very unfortunate to see that the stories depicted in the carvings have all been lost. Wish they are restored sometime...,Simhachalam Temple
26.0,Lakshmi Narasimhaswamy covered in Sandal paste,Simhachalam Temple
27.0,Ugraha Narasimhaswamy and that's why he is permanently covered in Sandal paste. Could have darshan only for few seconds similar to Tirupati Balaji temple. Preferred mode of visit is private cab or government bus since ola/uber pick up point is far away.,Simhachalam Temple
28.0,The best Temple for Narsimha Swamy,Simhachalam Temple
29.0,"The temple was very nice for our family because we prayed very well.
We went for special Darshan and there was less queue.",Simhachalam Temple
30.0,The powerful Narsimha Swamy,Simhachalam Temple
31.0,"This is a must visit temple for the Hindus. It hosts a Veda patashala and sends purohits to temples in various places.

The temple is atop a small hill and can be approached through several routes.

The crowd levels have increase significantly and the temple authorities have introduced a complex queue line system. All the space inside the temple has been taken up by long steel barriers. It is better to avoid weekends if you want to have a peaceful darshan. Elderly people better buy 100 darshan tickets to avoid walking long distance. Authorities should shorten queue system when the crowds are less. We were forced to walk for several hundred metres even there were no people ahead of us. It took us 15 min to reach the last of the piligrims ahead of us. Coconuts and Tulsi malas are not allowed inside the main deity. You will have to submit them to a small idol in the queue system only.

Getting a view of the idol compensates for all the trouble taken. Prasad was distributed on our bare hands though there were leaf cups available in the office. Drinking water system is available but not convenient.

Some piligrims put their arms around a pillar. They believe that if their fingers touch, they are blessed. Now a person asks you to embrace the pillar and ties a rope around for a few seconds and then collects money for that.",Simhachalam Temple
32.0,Hara narasimha,Simhachalam Temple
33.0,Most powerful place in this world really surprised with miracles of some really saw. Thanks god should I want to visit this Temple with my family love you God always with your blessings I am good,Simhachalam Temple
34.0,Oldest Architecture.,Simhachalam Temple
35.0,"This Temple is located near to vishakapatnam it's a distance about to around 5km from Vizag, probably one of the most Beautiful Temples to visit.",Simhachalam Temple
36.0,Simhachalm temple,Simhachalam Temple
37.0,Lord narasimha swamy temple situated on up hill buses are available from various place in Visakhapatnam.After reaching the simhachalm you can also go by walk steps are available nearly 1000 steps. Lord narasimha swamy in simhachalm temple,Simhachalam Temple
38.0,simhachalam temple visit,Simhachalam Temple
39.0,i suggest if any tourist visit to Vizag stay at dolphin hotel and have relax in hotel and enjoy with great tasty food with different varieties veg and Non veg. Dolphin hotel is a family hotel were u feel very comfortable with the smiley staff.,Simhachalam Temple
40.0,Blessed to have excellent Darshan,Simhachalam Temple
41.0,"there were 3 type of Darshan Queue free, Rs20 and Rs 100. since we went in morning before temple Darshan opens we took Rs20 tickets. Temple Darshan opens at 7 am. we were first few to take Darshan. I was told normally on Saturday and Sunday there is lot of rush weekdays are normally fine.

once you take Darshan, there is another optional ticket of Rs 200 by which you can go really close and also a special prayer is offered with your name and gotra, this 200 ticket also entitles you for Prasad (2 lados)

most of places there is nothing in Hindi or English, so good have someone who knows local language.",Simhachalam Temple
42.0,One of the most renowned temple in South India,Simhachalam Temple
43.0,Travelling to Simhachalam from Vizag using public transport is not much difficult. Its approximately 16 Kms away and one can get regular buses to Simhachalam foot hill. Then one needs to take another bus to hill top in front of Simhachalam temple. One can take the paid entry of Rs20 to avoid queue. Another entry fee of Rs100 is also there. Uber and Ola are available and will charge approx 400 from vizag RK beach to temple.,Simhachalam Temple
44.0,OLD TEMPLE WITH EXCELLENT ARCHITECTURE AND FACILITIES,Simhachalam Temple
45.0,"I have been a frequent visitor for past so many years. Now lot of new facilities including lift for elderly and new area with a very good aesthetic architecture has been built.
With grace of Varaha Lakshami Narasimha Swamy this temple area is growing very nicely.",Simhachalam Temple
46.0,Large Temple Complex,Simhachalam Temple
47.0,There are three levels of paid lines. Go for the middle one at least to avoid the crowd. There is a show and a phone stand outside. Overall the arrangement and crowd control is decent.,Simhachalam Temple
48.0,Simachalam temple,Simhachalam Temple
49.0,The temple is at the outskirts of Vishakapatanam. It is of much local importance. People flock here to offer prayers and also special occasions like marriages and tonsure rituals are also held. Its a huge complex with lot of people regularly engaged in temple activity.,Simhachalam Temple
50.0,A must visit for every Hindu,Simhachalam Temple
51.0,This is a must visit place if you are visiting Vizag. The temple is devoted to one of the vishnu;s incarnation. Place is nearly 15 kms from the city. one can take a bus from Dwaraka bus complex. It is advised to go to visit this temple early in the day as the crowd is not much. We took a 100 Rs darshan ticket and it was done in 15-30 mins.,Simhachalam Temple
52.0,Very pleasant,Simhachalam Temple
53.0,We can get a very fine view of the surrounding hills from the top. The route to the top of the hill is also nice.,Simhachalam Temple
54.0,Get Blessings :),Simhachalam Temple
55.0,Lord Narasimha swamy temple is best known for chandana utsav. Many people do pada yatra to get good feel of hinduism and our tradition,Simhachalam Temple
56.0,Nrusinh temple,Simhachalam Temple
57.0,"This is a good Nrusinh temple. If you are with older people, they have lift on one side. Unfortunately it was not working when i went with my parents and security allowed them after we bought Rs 200 pass.",Simhachalam Temple
58.0,Wonderful Narasimha Temple,Simhachalam Temple
59.0,"A wonderful, well maintained Sri Varaha Lakshmi Narasimha Temple near Visakhapatnam. Must not be missed.",Simhachalam Temple
60.0,A great Vaishnavite pilgrim centre.,Simhachalam Temple
61.0,"A well maintained and ancient temple not to be missed at Vizag. The murthy of the Lord is covered in sandal paste and uncovered only once in a year. If there is crowd take Rs 100 special darshan ticket and near sanctum, take another Arathi ticket @ Rs 100 per head to have a close darshan of the Lord.",Simhachalam Temple
62.0,Simhachalam temple,Simhachalam Temple
63.0,"Worshipping Sri Laxmi Narasimha Swamy, brings us peace, happiness, and eternal joy.
The sun actually peeked from over the hills it revealed the most spectacular view.
Varaha Lakshmi Narasimha temple, Simhachalam
It is at 4,900 ft above the sea level. the huge mountain and its surrounding dense forests.
It has many modern facilities for devotees at the hill shrine and foothill.
It is a true truly relaxing with an awesome travel experience.",Simhachalam Temple
64.0,Long Qs,Simhachalam Temple
65.0,"Be prepared for long q
Very revered
Large walk thru to reach d temple
Parking available
Large crowd at this place",Simhachalam Temple
66.0,Nice temple and worth visiting for religious people,Simhachalam Temple
67.0,"Nice temple and the hill shows nice views. One could reach easily all the way till top in taxi. Normally there is a long queue for getting inside the temple but you can get into faster queues by burying Rs 20 or 100 per head tickets. I think Rs 20 ticket is best as it was shorter than free darshan queue while it was just little longer than Rs 100 queue. There was free prasad being distributed in the temple. Overall, worth a visit for religious people.",Simhachalam Temple
68.0,Simhachalam Temple,Simhachalam Temple
69.0,"The cab or the auto will take you to the simhachalam mandir.However due to the gradient the autos usually do not go up to the temple, rather they would leave you near the base of the hill, from there one can share buses and sumos which climbs up to the mandir on minimum fares. I would caution pilgrims to reach before 11:30 hrs otherwise the main gate is closed for 1hour when you have to wait in the queue to offer homage to Lord Narshimham. The temple is a beautifully intricately rock cut temple with gopuram or sanctum at middle. One is not allowed to go inside the gopuram. The temple and the deity is treat to the eyes and mind.",Simhachalam Temple
70.0,A good thought but returned failure.,Simhachalam Temple
71.0,A must visit. A good start of the day starts by a morning darshan of the diety. The journey of vishakhapatnam was happening but I tried to have darshan but missed it as it was a rush day. Tried through vip line but most people have same thought so a long queue so to visit it should be early in the morning.,Simhachalam Temple
72.0,Find peace of mind,Simhachalam Temple
73.0,Whenever I visit this place I find imminence peace while having the darshan inside the main temple -this cannot be expressed in words.,Simhachalam Temple
74.0,Ancient Temple,Simhachalam Temple
75.0,"The Simhachalam temple is one of the most ancient temples, in Andhra Pradesh, situated. The place has a pleasant climate all over the year. The temple has an unique and agelong mythological background. The temple is neither disturbed not distracted from the agelong conventions, traditions, and ritualistic performances inspite of many economical, political or religious controversies or conflicts in the region.
It is an unparalled and uncomparable temple of its kind not only in the North Circars or Uttarandhra, but in the entire Telugu speaking regions. Though every village in the Telugu nadu is hailed at least by a small Rama Mandiram, the next place goes to Narasimha Temples. Most of them are happended to be ancient temples. In seemandhra, in Telangana, in Rayala seema, and even in the farther Southern regions, presence of a number of Narasimha Temples supports this statement

From days unknown till today a good number of functions like the annual, half yearly, quarterly, fortnightly, weekly and daily ritualistic functions are observed in this temple verbatim. The traditions and conventions stay very hard here and are never disturbed either by the day to day increasing flow of the pilgrims or by the local political disturbances. This ancient temple, which has undisturbed traditions and customs preserved for centuries together, has an, unparalleled and uncomparable place in the history of Sri Vaishnavaite cult.
The arrangements for worship in this temple are very good.One can have adivine experience if you visit in the mornings and Evenings.",Simhachalam Temple
76.0,God Management Of Simhachalam Temple,Simhachalam Temple
77.0,Sri Lakshmi Narasimha vari Devasthanm is the body managing Simhachalm Temple. The Temple is one of the important Temple in Andhra and attracts huge Crowds.The Devasthanam over the years have improved amenites to Pilgrims and facilities. It desrves Commendation.Ofcourse a visit to the temple is a divine experience,Simhachalam Temple
78.0,Simachalam Temple,Simhachalam Temple
79.0,The Simachalam temple is located on a hill top about 30 mins drive from Vizag. The main deity is Lord Narshimha. We had been here in the morning and had a very nice darshan of the Lord.,Simhachalam Temple
80.0,Very old and ancient temple,Simhachalam Temple
81.0,"Visit at least once in your life, good place , neat and clean. Little bit crowded but did not take more than 30mins.",Simhachalam Temple
82.0,Best Temple,Simhachalam Temple
83.0,"Simhachalam temple located around 15 KM from central Vizag is a best temple of God Narsinha , which we visited on early morning of 13 September 19. To avoid crowd and early entry it is better to start around 7 AM from Vizag so no long waiting period for dharshan. But in season crowd starts since donor opens around 7.40AM. Idol of Narsinha also natural creation which covered with sandalwood coating.Surrounding of simhachalam also best place to see and have a walk.With payment of Rs 200, couple permitted to see idol closely and offer prays with prayer. After taking Narsinha dharshan , other idols also worth to see and visit.",Simhachalam Temple
84.0,Divine place on top in middle of beautiful trees hills,Simhachalam Temple
85.0,Om Namo Simhachala Swamye namaha... we went as a couple. reached by 12 pm but too late for Kalyanam... for Kalyanam you should be there by 7 or max by 9 am... nice holy pleasant place to visit from Aug to Jan due to pleasant fog cold climate.. take 200 rs ticket per pax to have garbha gudi darsanam. Else go for 100 rs for quick darsanam,Simhachalam Temple
86.0,Tick on bucket list,Simhachalam Temple
87.0,The people have immense regards for the temple. But you dont see much architecture. It can be a one time visit but could also be skipped if you not one of the worshipers. There is an easy bus access no. 6 A goes to the temple from the simhachalam city.,Simhachalam Temple
88.0,It is a nice devotional place,Simhachalam Temple
89.0,It is general located out the visakhapatnam in simhachalam. Generally rtc bus service will be there to the temple .it is nice place .it is a devotional place of Lakshmi narasimha .and we can through the bus or by walk to the temple,Simhachalam Temple
90.0,A True Divine Experience,Simhachalam Temple
91.0,"One of the important Pilgrimage Center in East Coast of India. Located on a Hill 500 M above sea level near Visakhapatnam, this temple is decicated to Lord Vishnu (Narsimha Avatar). A serene and Peaceful Place.",Simhachalam Temple
92.0,Divine place,Simhachalam Temple
93.0,"I visit this temple often.
Tip: Try to visit on weekdays to skip the line and note the darshan timings ahead",Simhachalam Temple
94.0,A TEMPLE WORTH SEEING,Simhachalam Temple
95.0,"Though it is very close, I have visited the temple after 2 years. The best time to visit the temple is on Monday to Wednesday. On other days there is lot of rush from Orissa and other neighboring states. A new rule is implemented recently. CELLPHONES/CAMERAS NOT ALLOWED INSIDE THE TEMPLE. They have a counter where you can deposit your phone/camera and collect it later on. The atmosphere on top is very cool and neat. The volunteers are quite good and helpful.",Simhachalam Temple
96.0,Serene,Simhachalam Temple
97.0,This temple is a little far fom Vishakhapatnam. The temple is similar to Sri Tirupathi Temple in Andhra Pradesh. One should vist this Temple in Vishakhapatnam.,Simhachalam Temple
98.0,Not worth,Simhachalam Temple
99.0,It is a temple located on Simhachalam temple. Nothing much to see apart from the temple. If you are very religious then please visit by all means else you would be better off visiting Kailashgiri.,Simhachalam Temple
100.0,real god in visakhapatnam,Simhachalam Temple
101.0,really excellent darshan of Lord VARAHA LAKSHMI NARASIMHA SWAMY . every thing is nice .. i have to come again to darshan,Simhachalam Temple
102.0,Great darshan,Simhachalam Temple
103.0,"Went to the temple around 4PM.
It was Rs.200/- ticket to get into the inner sanctum
Had a fantastic very close darshan of the Lord.Felt Blessed",Simhachalam Temple
104.0,Great place to visit,Simhachalam Temple
105.0,"This was really nice place to visit with quite helping and smiling people around.
We wish to come back on Akshay Trutiya",Simhachalam Temple
106.0,divine,Simhachalam Temple
107.0,"must visit, hill top. private vehicle two way will be handy if with family. VIP darshan pass is a good idea",Simhachalam Temple
108.0,The number two temple only next to Tirupati.,Simhachalam Temple
109.0,Situated around 20kms away from city on a hill Simhachalam is the only temple in the world having Narasimha Swamy in both Laxmi and Varaha avatar. A 11cenCE temple made up of granite is worth visiting for every religious touris to the city. It is highly regarded both from people of Andhra and boardering Odissa. Many people visiting this place give away their hair. The view at night is amazing. God is always kept wrapped with a sandal paste of 100 kg brought specially from Kerala. Just concluded is Chandana Utsav when the sandal paste put on the God is removed to offer darshan of the real God when lakhs of people visit to see the actual shape of the God.,Simhachalam Temple
110.0,Simhachaam temple,Simhachalam Temple
111.0,Visited this temple three months back. Went for Abhishekam. Purohits came 3 hrs late. Felt very bad.,Simhachalam Temple
112.0,Poor amenities and high price.,Simhachalam Temple
113.0,"I visited on 5/May/19. 2 days before the famous annual Chandanotsvam. I went for keshkhandanam (giving away your hair). The cost is Rs 25. Higher than Tirumala or Annavaram. Bathroom facility is in a different building, and another Rs 5 is charged for that. And water is only coming in wash basin taps. Very pathetic state of things.
Though on the other hand the Rs100 special darshanam queue was real quick. No stoppage, only your walking speed would decide. The prasadam sales counter was extremely crowded. I didn't dare to go in.",Simhachalam Temple
114.0,A full moon darshan,Simhachalam Temple
